{
  "schemaVersion": 2,
  "firmware": "FM-1_921",
  "reviewedOn": "2026-10-15",
  "reviewedSources": {
    "editor/src/graph/types.ts": "84df856c4053473ec409753e072d0292d34c5a6cdf5d49c4e8fd60b4423ff61b",
    "editor/src/graph/nodeTypes.ts": "906b9042d383228df616b4c8f8da844856bb9d90c5f7fe359b57aeabc62f8a59",
    "editor/src/graph/subpatch.ts": "56fd60b9c664479761eefaa1e4d5264160156974687bc529aba01716ed2fbeb5",
    "editor/src/graph/spread.ts": "58bec3d980343612b1fc6e31059ab2926b50455f7a547129ffd24b071d81a0da",
    "editor/src/graph/expression.ts": "3d9ffced8af6611ed9b59414f2917895aa21fbf2d0f145d59eeab71a9ab34995",
    "editor/src/audio/dspProgram.ts": "4a4b1e17c61adf7885147812400dfb8e9d8f10fb8a2f3265c239aeacaf65e457",
    "editor/src/audio/dspOpcodes.ts": "3e605442a356c87dd1c6aef58ce0d00d762c5ed31da0499b90e962181fed55ee",
    "editor/src/audio/fm1Package.ts": "f63cff9f1feaf41aef939d0c540684ee1cb7dd99601204af693bc007cbe27c9c",
    "editor/src/audio/fm1Optimizer.ts": "c4aefb17286a0f80a2dcc2553b3e4c5bbe8fcb8f302c4e9eec095c1b3a03e9f0",
    "editor/src/audio/fm1Upload.ts": "77e2e199f523b95bb047e9dada2aa4725e03d8b9eb112d66a9d0c412fb0f0b96",
    "editor/src/audio/useFm1LiveEdit.ts": "f713142b090b52bd6f8322e9fda1648dbf2f7a3dde08aa99a4c5c657776fdb7e",
    "editor/src/editor/NodeEditor.tsx": "97d12814833640f1c9fa16ed9e181a1cc1a0a8814a0f54519d76306a7cacc657",
    "editor/src/editor/ShaderNode.tsx": "e7c7f12b6d7e3aa4162f052edbfdbd5b5afdf13c2c456e9067eaba1173f41127",
    "editor/src/editor/Fm1ModeContext.ts": "cc1bc130ec1638f62f27ce14997e86f8dae35e3a891d44702cab054b496fc5fd",
    "editor/src/audio/fm1Support.ts": "c7bc3b9979a76822aaf3b72acb914ce2e75e1abf37ff761c965e6e07e7ae363d",
    "editor/src/audio/fm1Capabilities.ts": "7a29929da790792dc3e54b3139cda2a4230e8f971fc5e101dade126a33a556cd",
    "editor/src/editor/Fm1SupportPage.tsx": "4f634b0db59887bc62a1a8a0dbe811e563683ee4cfa534a3a4aa8a1760264f49",
    "editor/src/App.tsx": "a7ab18f0eea1c2c9e395d4c01b34d58621d483f7e9069b4325e82ff3a7da4eee",
    "editor/src/styles.css": "2a3573012aaf0a5b04e11aeb1c29b05127b15b8bb2f92327bc8ff3bc0d6ab14e",
    "firmware/fm1/runtime.h": "7537b66a1045b93e2d5db70cb42c37d90a123322b687073a4fd1527c3c2480ad",
    "firmware/fm1/app.c": "3d32135afb8c1f704f3cee8266386ca56b78e8b285633fa7ce8b24b4c5075c00",
    "firmware/fm1/upload.h": "fe5d2b0469e85b0ae7af404089885b4f50561a0fd7f7dd3e5b1f80a19433b266",
    "firmware/fm1/export-patch.mjs": "f4080ecd3b6e5c20490cba612cc582a1396527ef5d9cfd4c85fc60e191645e55",
    "scripts/fm1-runtime-spike.py": "c1456307c522e6d52494e1f6d51921bc196482d6b5946b1dadde0405378ae958",
    "scripts/fm1-send-patch.py": "8dff7e8ae136c2fce5ef04c8d0b3d15f745f971cf6d94418d7f393f4b1623cad",
    "scripts/fm1-install.py": "cb0b4d51615e40b164fd767964d845a65f3931c194d698c650b724f9825f228c",
    "editor/src/diagnostics.ts": "eeed709b3d569dc320dccaaf956dc903ea0c192e88d890440a5c9c2cd9ca8480",
    "runtime/src/index.ts": "428283ed669a780a0a1d31c3ae63f85c9c6cbf30952c27023065ec62a74dcb05",
    "editor/src/graph/parse.ts": "769600d7bc6858f0d2c83a4e9cd3b50329df0adbced9331f1da85c70dbe3f2e8",
    "editor/src/graph/serialize.ts": "b79eeb691c8f22ec11bb4cfa750b5720cc8af4674d0e9eabf13aa642d876109a",
    "editor/src/audio/dspEdit.ts": "04dc064fc4b22afa52ab4aaa6a0382b0b9466d8f0a2c507c63e8f7c05ed04076",
    "editor/src/audio/patchPackage.ts": "da3021756b4a8fa10606056bfd8d282248e4ff0a3e63892227284a3931d6decf",
    "editor/src/hosted/document.ts": "2c8dc864316db5c6d789485449d94f7e76492a52dc7ccfa81430b6279ae866fd",
    "editor/src/hosted/compiler.ts": "a6649dc7b3dc1da06139a47576b2189fde1b0ef3ec06ee7fcbeb24f9fb4ac0a1",
    "editor/src/hosted/native.ts": "8e817707257dad677252340d7066c85188265111cf83bf0d4fcb335ad9e235a9",
    "editor/src/hosted/bridge.ts": "9e98890329897f150648d7ebd5f97175140d6ccb4f28c01c3983c509c84ff8a9",
    "editor/src/hosted/session.ts": "f0ef11f68816df01e24d37def2634f274120e68ca15dc38dc1751d21c4fae7bb",
    "editor/src/hosted/assets.ts": "1a529b112504a7987a8cb48d79e41d636ad021566dd659cd2d0966a0153bb651",
    "editor/src/hosted/parameters.ts": "cab08af00bdc37d6ffbb99f6691eb512697ccc0ad1d568c6f2400f481bf61c6d",
    "editor/src/hosted/useHostedAudio.ts": "b88ebf818bcf27d66567db79d6fe4d8a1bec2d50ebdae87ef1a235a9656c87a0",
    "editor/src/hosted/HostedNodeEditor.tsx": "f1d0a5cd30c90146f2d37c4b09bfbe54b48e03f5dad8d9e75c194f00f55c8255",
    "editor/src/hosted/HostedModeContext.ts": "037cfd1b3fb901f6e87436723fde6deb36aece15713fb72a8104cf42e5dfb1de",
    "editor/src/hosted/mockBridge.ts": "2ff7454b8aefe963ec2956c6dba068b272ca087b017f9bdcfee82cbe043f7e62",
    "editor/src/hosted/package.ts": "8941f0cf8acbff01a734a403ed63b8a76f1129423bf3281331597b2a77b3496c",
    "hosted/package.json": "b158aac159e3ce2937d6675845b53cbee26a1bc4e2c77ade6c71f5dc607e61af",
    "runtime/package.json": "948d13582e59a070522d2cd4d57898eea40936264c4ce747c54d683c278e39a1",
    "rust/teia-kernel/Cargo.toml": "bf4525d61264227f363fe583fc05d6da82b517487a8fa7418240f5ede6594ad7",
    "scripts/build-hosted.mjs": "e2adbe4cf74dce7033142d52884d08a95d3ebfa0adab0146a27dc37f5974db80",
    "scripts/build-hosted-conformance.mjs": "e10f5785cb07c1a6fe98d2d8654853719bc628c97b85d04c6a1a6c9dfbb21928",
    "rust/teia-kernel/src/state_fields.rs": "e01c2ef270fb46a904c850c68a7cd6bcfc82436fad36cfc97751f4ddc5d037a9",
    "rust/teia-kernel/src/runtime_preparation.rs": "2a066fdf79bc109459897fe7f0d22ccf4bacbf2631ede31b13d29115b02b577c",
    "rust/teia-kernel/src/hosted_resources.rs": "51f57778dc523816f0e711ba4e5829c7d574ab4e853f4d410824cfcaa5d5e77b",
    "rust/teia-kernel/src/hosted_observation.rs": "ad005c16d4303329bcd938938484097324c9aaca038ed86a18e5c19953c75a1e",
    "rust/teia-kernel/src/bounded_repeats.rs": "2f3e45a04f788f95a12a58dd7f1b84207e5e1a5fa9b4c829f5ee4dfb2e4fb998",
    "rust/teia-kernel/src/runtime-capabilities.json": "db1f595d6e7118c60c5a2c4ee0b36a7a99084958a2f15f86abad3145b3b36920",
    "editor/src/hosted/engineCapabilities.json": "db1f595d6e7118c60c5a2c4ee0b36a7a99084958a2f15f86abad3145b3b36920",
    "scripts/engine-capabilities.mjs": "1250e52155d1ba3931976ce63706728bf24a81fc39fa05dc4d2923af601a65e3",
    "rust/teia-kernel/src/lib.rs": "d2d835d87a2a5f981a7dde5999c58ce01757f5975eb2ebf15653a36417c58a36",
    "rust/teia-kernel/src/native_state.rs": "8a0824dc795694aed1f03ee73830d158debd70b6e59d44abd137d6d7f8897259",
    "rust/teia-kernel/src/hosted.rs": "5131a2be03b43f3f4fc1b2298d6f335416dda830a93e07da641b63617864c332",
    "editor/public/audio/audio-worklet-wasm.js": "566b31a68db9d30ad5adc75eebce49f446e3b5e0ab5dc9a7b76a53aa7905e3c0"
  },
  "features": [
    {
      "id": "Expression",
      "category": "node",
      "status": "partial",
      "since": 904,
      "verification": "source reviewed",
      "notes": "Basic arithmetic since 904; 907 adds abs/min/max/clamp/floor/ceil/round/sign/fract, comparisons and boolean logic. Q16.16 arithmetic; since 913 the basic add/subtract/multiply/divide graph instructions clamp results to ±12000 like WASM; round ties away from zero. Transcendentals, pow, sqrt and mix remain unsupported.",
      "evidence": [
        "editor/src/audio/fm1Package.ts",
        "firmware/fm1/runtime.h",
        "firmware/fm1/README.md"
      ],
      "blockedInputs": [],
      "blockedOutputs": []
    },
    {
      "id": "Group",
      "category": "node",
      "status": "partial",
      "since": null,
      "verification": "source reviewed",
      "notes": "Structural routing is flattened by the graph compiler. Every enabled contained node must independently pass FM-1 eligibility; this is not a claim that arbitrary group contents are supported.",
      "evidence": [
        "editor/src/graph/subpatch.ts",
        "editor/src/audio/dspProgram.ts"
      ],
      "blockedInputs": [],
      "blockedOutputs": []
    },
    {
      "id": "Spread",
      "category": "node",
      "status": "partial",
      "since": 921,
      "verification": "source reviewed",
      "notes": "Since 921, independent bounded DSP instances, boundary sum/product collectors and internal item index or instance gate. Up to eight containers and eight instances each; the compiler lowers capacity to fit 32 shared state records. Spread count is latched per audio block and clamped to capacity; shrinking clears removed item state. Spawn uses rising trigger edges, matching release tags and per-instance rising kill edges; full containers drop new triggers. Delay and Tempo must be outside containers; nested containers remain unsupported. Package reload resets instances. Hardware timing and audio unverified.",
      "evidence": [
        "editor/src/audio/fm1Package.ts",
        "firmware/fm1/runtime.h",
        "firmware/fm1/app.c"
      ],
      "blockedInputs": [],
      "blockedOutputs": [],
      "drift": {
        "webBehavior": "Dynamically allocated instance counts, independent effect resources and state migration during live recompilation.",
        "firmwareBehavior": "Fixed capacity from the shared state budget; Delay and Tempo are rejected inside templates. Stable pool-slot rendering order, no migration on package reload.",
        "requiredWork": "Verify voice lifecycle and real-time deadlines on hardware; additional voices and per-instance delays require a larger resource budget."
      }
    },
    {
      "id": "Spawn",
      "category": "node",
      "status": "partial",
      "since": 921,
      "verification": "source reviewed",